14:40:25.080465 IP rhelgw.blade4.9016 > la120114.apac.avaya.com.51844: Flags [P.], seq 2754013900:2754014109, ack 4050290167, win 501, length 209
14:40:25.109398 IP rhelgw.blade4.ssh > la120114.apac.avaya.com.52001: Flags [P.], seq 1214854547:1214854755, ack 1117532327, win 146, length 208
14:40:25.109832 IP la120114.apac.avaya.com.52001 > rhelgw.blade4.ssh: Flags [.], ack 208, win 255, length 0
14:40:25.116295 IP rhelgw.blade4.33541 > in307437-pune-dns-ns1.apac.avaya.com.domain: 44099+ PTR? 219.224.147.148.in-addr.arpa. (46)
14:40:25.116835 IP in307437-pune-dns-ns1.apac.avaya.com.domain > rhelgw.blade4.33541: 44099* 1/0/0 PTR la120114.apac.avaya.com. (83)
14:40:25.117231 IP rhelgw.blade4.48492 > in307437-pune-dns-ns1.apac.avaya.com.domain: 6470+ PTR? 74.168.27.135.in-addr.arpa. (44)
14:40:25.117717 IP in307437-pune-dns-ns1.apac.avaya.com.domain > rhelgw.blade4.48492: 6470* 2/0/0 PTR in307437-pune-dns-ns1.apac.avaya.com., PTR avya-in307437-pune-dns-ns1.avaya.com. (135)
14:40:25.176848 ARP, Request who-has 10.133.39.37 tell 10.133.39.1, length 46
14:40:25.177082 IP rhelgw.blade4.56123 > in307437-pune-dns-ns1.apac.avaya.com.domain: 64045+ PTR? 37.39.133.10.in-addr.arpa. (43)
14:40:25.177754 IP in307437-pune-dns-ns1.apac.avaya.com.domain > rhelgw.blade4.56123: 64045 NXDomain* 0/1/0 (128)
14:40:25.177925 IP rhelgw.blade4.48732 > in307437-pune-dns-ns1.apac.avaya.com.domain: 37246+ PTR? 1.39.133.10.in-addr.arpa. (42)
14:40:25.178384 IP in307437-pune-dns-ns1.apac.avaya.com.domain > rhelgw.blade4.48732: 37246 NXDomain* 0/1/0 (127)
14:40:25.279595 IP la120114.apac.avaya.com.51844 > rhelgw.blade4.9016: Flags [.], ack 209, win 256, length 0
14:40:25.282315 ARP, Request who-has 169.254.0.2 tell 169.254.0.1, length 46
14:40:25.282559 IP rhelgw.blade4.42846 > in307437-pune-dns-ns1.apac.avaya.com.domain: 33871+ PTR? 2.0.254.169.in-addr.arpa. (42)
14:40:25.545504 IP rhelgw.blade4.teradataordbms > 63vbg32.apac.avaya.com.60687: Flags [P.], seq 2716865453:2716865565, ack 4113693750, win 180, length 112
14:40:25.576187 IP in307437-pune-dns-ns1.apac.avaya.com.domain > rhelgw.blade4.42846: 33871 NXDomain 0/1/0 (119)
14:40:25.576516 IP rhelgw.blade4.58391 > in307437-pune-dns-ns1.apac.avaya.com.domain: 31391+ PTR? 1.0.254.169.in-addr.arpa. (42)
14:40:25.667003 ARP, Request who-has 10.133.39.89 tell 10.133.39.1, length 46
14:40:25.740474 IP 63vbg32.apac.avaya.com.60687 > rhelgw.blade4.teradataordbms: Flags [.], ack 112, win 251, length 0
14:40:25.761083 IP rhelgw.blade4.9017 > la120091.apac.avaya.com.60254: Flags [P.], seq 2854342519:2854342631, ack 1048904258, win 157, length 112
14:40:25.812678 IP la120091.apac.avaya.com.60254 > rhelgw.blade4.9017: Flags [.], ack 112, win 251, length 0
14:40:25.840996 IP in307437-pune-dns-ns1.apac.avaya.com.domain > rhelgw.blade4.58391: 31391 NXDomain 0/1/0 (119)
14:40:25.841425 IP rhelgw.blade4.49441 > in307437-pune-dns-ns1.apac.avaya.com.domain: 31314+ PTR? 164.224.147.148.in-addr.arpa. (46)
14:40:25.842212 IP in307437-pune-dns-ns1.apac.avaya.com.domain > rhelgw.blade4.49441: 31314* 1/0/0 PTR 63vbg32.apac.avaya.com. (82)
14:40:25.842449 IP rhelgw.blade4.58956 > in307437-pune-dns-ns1.apac.avaya.com.domain: 3617+ PTR? 89.39.133.10.in-addr.arpa. (43)
14:40:25.843202 IP in307437-pune-dns-ns1.apac.avaya.com.domain > rhelgw.blade4.58956: 3617 NXDomain* 0/1/0 (128)
14:40:25.843405 IP rhelgw.blade4.45629 > in307437-pune-dns-ns1.apac.avaya.com.domain: 31510+ PTR? 115.230.147.148.in-addr.arpa. (46)
14:40:25.844102 IP in307437-pune-dns-ns1.apac.avaya.com.domain > rhelgw.blade4.45629: 31510* 1/0/0 PTR la120091.apac.avaya.com. (83)
14:40:25.896919 ARP, Request who-has 10.133.39.91 tell 10.133.39.1, length 46
14:40:25.897281 IP rhelgw.blade4.35931 > in307437-pune-dns-ns1.apac.avaya.com.domain: 11500+ PTR? 91.39.133.10.in-addr.arpa. (43)
14:40:25.897846 IP in307437-pune-dns-ns1.apac.avaya.com.domain > rhelgw.blade4.35931: 11500 NXDomain* 0/1/0 (128)
14:40:25.956911 ARP, Request who-has 10.133.39.91 tell 10.133.39.1, length 46
14:40:26.067417 ARP, Request who-has 10.133.39.91 tell 10.133.39.1, length 46
14:40:26.171535 IP rhelgw.blade4.9017 > la120114.apac.avaya.com.51135: Flags [P.], seq 659775984:659776096, ack 2153571225, win 157, length 112
14:40:26.227301 ARP, Request who-has 10.133.39.91 tell 10.133.39.1, length 46
14:40:26.282364 ARP, Request who-has 169.254.0.2 tell 169.254.0.1, length 46
14:40:26.371831 IP la120114.apac.avaya.com.51135 > rhelgw.blade4.9017: Flags [.], ack 112, win 255, length 0
14:40:26.666972 ARP, Request who-has 10.133.39.89 tell 10.133.39.1, length 46
14:40:27.227106 ARP, Request who-has 10.133.39.91 tell 10.133.39.1, length 46
14:40:27.282256 ARP, Request who-has 169.254.0.2 tell 169.254.0.1, length 46
14:40:27.377111 ARP, Request who-has 10.133.39.37 tell 10.133.39.1, length 46
14:40:27.437109 ARP, Request who-has 10.133.39.37 tell 10.133.39.1, length 46
14:40:27.547240 ARP, Request who-has 10.133.39.37 tell 10.133.39.1, length 46
14:40:27.707130 ARP, Request who-has 10.133.39.37 tell 10.133.39.1, length 46
14:40:27.987007 ARP, Request who-has 10.133.39.93 tell 10.133.39.1, length 46
14:40:27.987399 IP rhelgw.blade4.59705 > in307437-pune-dns-ns1.apac.avaya.com.domain: 54004+ PTR? 93.39.133.10.in-addr.arpa. (43)
14:40:27.987916 IP in307437-pune-dns-ns1.apac.avaya.com.domain > rhelgw.blade4.59705: 54004 NXDomain* 0/1/0 (128)
14:40:28.047033 ARP, Request who-has 10.133.39.93 tell 10.133.39.1, length 46
14:40:28.157350 ARP, Request who-has 10.133.39.93 tell 10.133.39.1, length 46
14:40:28.227015 ARP, Request who-has 10.133.39.91 tell 10.133.39.1, length 46
14:40:28.317074 ARP, Request who-has 10.133.39.93 tell 10.133.39.1, length 46
14:40:28.496954 ARP, Request who-has 10.133.39.239 tell 10.133.39.1, length 46
14:40:28.497314 IP rhelgw.blade4.49821 > in307437-pune-dns-ns1.apac.avaya.com.domain: 11983+ PTR? 239.39.133.10.in-addr.arpa. (44)
14:40:28.497864 IP in307437-pune-dns-ns1.apac.avaya.com.domain > rhelgw.blade4.49821: 11983 NXDomain* 0/1/0 (129)
14:40:28.557009 ARP, Request who-has 10.133.39.239 tell 10.133.39.1, length 46
14:40:28.587609 IP rhelgw.blade4.teradataordbms > 63vbg32.apac.avaya.com.60687: Flags [P.], seq 112:528, ack 1, win 180, length 416
14:40:28.664471 IP rhelgw.blade4.teradataordbms > 63vbg32.apac.avaya.com.60687: Flags [P.], seq 528:864, ack 1, win 180, length 336
14:40:28.665030 IP 63vbg32.apac.avaya.com.60687 > rhelgw.blade4.teradataordbms: Flags [.], ack 864, win 256, length 0
14:40:28.666888 ARP, Request who-has 10.133.39.239 tell 10.133.39.1, length 46
14:40:28.706891 ARP, Request who-has 10.133.39.37 tell 10.133.39.1, length 46
14:40:28.786013 IP rhelgw.blade4.9017 > la120091.apac.avaya.com.60254: Flags [P.], seq 112:224, ack 1, win 157, length 112
14:40:28.827135 ARP, Request who-has 10.133.39.239 tell 10.133.39.1, length 46
14:40:28.836359 IP la120091.apac.avaya.com.60254 > rhelgw.blade4.9017: Flags [.], ack 224, win 251, length 0
14:40:29.205595 IP rhelgw.blade4.9017 > la120114.apac.avaya.com.51135: Flags [P.], seq 112:736, ack 1, win 157, length 624
14:40:29.209510 ARP, Request who-has 149.49.32.134 tell 149.49.32.134, length 50
14:40:29.209810 IP rhelgw.blade4.49268 > in307437-pune-dns-ns1.apac.avaya.com.domain: 64961+ PTR? 134.32.49.149.in-addr.arpa. (44)
14:40:29.210449 IP in307437-pune-dns-ns1.apac.avaya.com.domain > rhelgw.blade4.49268: 64961 NXDomain* 0/1/0 (129)
14:40:29.272994 IP rhelgw.blade4.9017 > la120114.apac.avaya.com.51135: Flags [P.], seq 736:1104, ack 1, win 157, length 368
14:40:29.273416 IP la120114.apac.avaya.com.51135 > rhelgw.blade4.9017: Flags [.], ack 1104, win 251, length 0
14:40:29.316995 ARP, Request who-has 10.133.39.93 tell 10.133.39.1, length 46
14:40:29.526567 IP 149.49.32.134.iad2 > 149.49.32.255.time: UDP, length 0
14:40:29.526879 IP rhelgw.blade4.43944 > in307437-pune-dns-ns1.apac.avaya.com.domain: 25516+ PTR? 255.32.49.149.in-addr.arpa. (44)
14:40:29.527512 IP in307437-pune-dns-ns1.apac.avaya.com.domain > rhelgw.blade4.43944: 25516 NXDomain* 0/1/0 (129)
14:40:29.707145 ARP, Request who-has 10.133.39.37 tell 10.133.39.1, length 46
14:40:29.827021 ARP, Request who-has 10.133.39.239 tell 10.133.39.1, length 46
14:40:29.846910 ARP, Request who-has 10.133.39.197 tell 10.133.39.1, length 46
14:40:29.847178 IP rhelgw.blade4.50912 > in307437-pune-dns-ns1.apac.avaya.com.domain: 16083+ PTR? 197.39.133.10.in-addr.arpa. (44)
14:40:29.847850 IP in307437-pune-dns-ns1.apac.avaya.com.domain > rhelgw.blade4.50912: 16083 NXDomain* 0/1/0 (129)
14:40:29.907224 ARP, Request who-has 10.133.39.197 tell 10.133.39.1, length 46
14:40:30.016972 ARP, Request who-has 10.133.39.197 tell 10.133.39.1, length 46
14:40:30.176990 ARP, Request who-has 10.133.39.197 tell 10.133.39.1, length 46
14:40:30.317052 ARP, Request who-has 10.133.39.93 tell 10.133.39.1, length 46
14:40:30.317074 ARP, Request who-has 10.133.39.57 tell 10.133.39.1, length 46
14:40:30.317438 IP rhelgw.blade4.43807 > in307437-pune-dns-ns1.apac.avaya.com.domain: 34591+ PTR? 57.39.133.10.in-addr.arpa. (43)
14:40:30.318084 IP in307437-pune-dns-ns1.apac.avaya.com.domain > rhelgw.blade4.43807: 34591 NXDomain* 0/1/0 (128)
14:40:30.377036 ARP, Request who-has 10.133.39.57 tell 10.133.39.1, length 46
14:40:30.487134 ARP, Request who-has 10.133.39.57 tell 10.133.39.1, length 46
14:40:30.647114 ARP, Request who-has 10.133.39.57 tell 10.133.39.1, length 46
14:40:30.827021 ARP, Request who-has 10.133.39.239 tell 10.133.39.1, length 46
14:40:30.940580 IP la120114.apac.avaya.com.51844 > rhelgw.blade4.9016: Flags [P.], seq 1:666, ack 209, win 256, length 665
14:40:30.940617 IP rhelgw.blade4.9016 > la120114.apac.avaya.com.51844: Flags [.], ack 666, win 501, length 0
14:40:30.948012 IP 10.133.73.11.45769 > rhelgw.blade4.53333: Flags [S], seq 3721106972, win 14600, options [mss 1460,nop,nop,sackOK,nop,wscale 9], length 0
14:40:30.948076 IP rhelgw.blade4.53333 > 10.133.73.11.45769: Flags [S.], seq 817313744, ack 3721106973, win 14600, options [mss 1460,nop,nop,sackOK,nop,wscale 7], length 0
14:40:30.948296 IP rhelgw.blade4.52435 > in307437-pune-dns-ns1.apac.avaya.com.domain: 46595+ PTR? 11.73.133.10.in-addr.arpa. (43)
14:40:30.948462 IP 10.133.73.11.45769 > rhelgw.blade4.53333: Flags [.], ack 1, win 29, length 0
14:40:30.948633 IP in307437-pune-dns-ns1.apac.avaya.com.domain > rhelgw.blade4.52435: 46595 NXDomain* 0/1/0 (128)
14:40:30.949174 IP 10.133.73.11.45769 > rhelgw.blade4.53333: Flags [P.], seq 1:129, ack 1, win 29, length 128
14:40:30.949179 IP rhelgw.blade4.53333 > 10.133.73.11.45769: Flags [.], ack 129, win 123, length 0
14:40:30.949919 IP rhelgw.blade4.53333 > 10.133.73.11.45769: Flags [.], seq 1:1461, ack 129, win 123, length 1460
14:40:30.949956 IP rhelgw.blade4.53333 > 10.133.73.11.45769: Flags [P.], seq 1461:2367, ack 129, win 123, length 906
14:40:30.950261 IP 10.133.73.11.45769 > rhelgw.blade4.53333: Flags [.], ack 1461, win 35, length 0
14:40:30.950931 IP 10.133.73.11.45769 > rhelgw.blade4.53333: Flags [.], ack 2367, win 40, length 0
14:40:30.950947 IP 10.133.73.11.45769 > rhelgw.blade4.53333: Flags [P.], seq 129:268, ack 2367, win 40, length 139
14:40:30.951081 IP 10.133.73.11.45769 > rhelgw.blade4.53333: Flags [P.], seq 268:274, ack 2367, win 40, length 6
14:40:30.951101 IP rhelgw.blade4.53333 > 10.133.73.11.45769: Flags [.], ack 274, win 131, length 0
14:40:30.951180 IP 10.133.73.11.45769 > rhelgw.blade4.53333: Flags [P.], seq 274:343, ack 2367, win 40, length 69
14:40:30.990286 IP rhelgw.blade4.53333 > 10.133.73.11.45769: Flags [.], ack 343, win 131, length 0
14:40:30.991189 IP rhelgw.blade4.53333 > 10.133.73.11.45769: Flags [P.], seq 2367:2373, ack 343, win 131, length 6
14:40:31.030480 IP rhelgw.blade4.53333 > 10.133.73.11.45769: Flags [P.], seq 2373:2442, ack 343, win 131, length 69
14:40:31.031002 IP 10.133.73.11.45769 > rhelgw.blade4.53333: Flags [.], ack 2442, win 40, length 0
14:40:31.031608 IP 10.133.73.11.45769 > rhelgw.blade4.53333: Flags [P.], seq 343:684, ack 2442, win 40, length 341
14:40:31.031618 IP rhelgw.blade4.53333 > 10.133.73.11.45769: Flags [.], ack 684, win 140, length 0
14:40:31.032020 IP 10.133.73.11.45769 > rhelgw.blade4.53333: Flags [P.], seq 684:833, ack 2442, win 40, length 149
14:40:31.032028 IP rhelgw.blade4.53333 > 10.133.73.11.45769: Flags [.], ack 833, win 148, length 0
14:40:31.072651 IP rhelgw.blade4.53333 > 10.133.73.11.45769: Flags [P.], seq 2442:2831, ack 833, win 148, length 389
14:40:31.078265 IP 10.133.73.11.45770 > rhelgw.blade4.53333: Flags [S], seq 3040435781, win 14600, options [mss 1460,nop,nop,sackOK,nop,wscale 9], length 0
14:40:31.078319 IP rhelgw.blade4.53333 > 10.133.73.11.45770: Flags [S.], seq 1870264333, ack 3040435782, win 14600, options [mss 1460,nop,nop,sackOK,nop,wscale 7], length 0
14:40:31.078979 IP 10.133.73.11.45770 > rhelgw.blade4.53333: Flags [.], ack 1, win 29, length 0
14:40:31.079509 IP 10.133.73.11.45770 > rhelgw.blade4.53333: Flags [P.], seq 1:129, ack 1, win 29, length 128
14:40:31.079532 IP rhelgw.blade4.53333 > 10.133.73.11.45770: Flags [.], ack 129, win 123, length 0
14:40:31.081151 IP rhelgw.blade4.53333 > 10.133.73.11.45770: Flags [.], seq 1:1461, ack 129, win 123, length 1460
14:40:31.081187 IP rhelgw.blade4.53333 > 10.133.73.11.45770: Flags [P.], seq 1461:2367, ack 129, win 123, length 906
14:40:31.081538 IP 10.133.73.11.45770 > rhelgw.blade4.53333: Flags [.], ack 1461, win 35, length 0
14:40:31.082163 IP 10.133.73.11.45770 > rhelgw.blade4.53333: Flags [.], ack 2367, win 40, length 0
14:40:31.082178 IP 10.133.73.11.45770 > rhelgw.blade4.53333: Flags [P.], seq 129:268, ack 2367, win 40, length 139
14:40:31.082295 IP 10.133.73.11.45770 > rhelgw.blade4.53333: Flags [P.], seq 268:274, ack 2367, win 40, length 6
14:40:31.082339 IP rhelgw.blade4.53333 > 10.133.73.11.45770: Flags [.], ack 274, win 131, length 0
14:40:31.082484 IP 10.133.73.11.45770 > rhelgw.blade4.53333: Flags [P.], seq 274:343, ack 2367, win 40, length 69
14:40:31.101302 IP rhelgw.blade4.9016 > la120114.apac.avaya.com.51844: Flags [P.], seq 209:418, ack 666, win 501, length 209
14:40:31.112550 IP 10.133.73.11.45769 > rhelgw.blade4.53333: Flags [.], ack 2831, win 46, length 0
14:40:31.122354 IP rhelgw.blade4.53333 > 10.133.73.11.45770: Flags [.], ack 343, win 131, length 0
14:40:31.123640 IP rhelgw.blade4.53333 > 10.133.73.11.45770: Flags [P.], seq 2367:2373, ack 343, win 131, length 6
14:40:31.163601 IP 10.133.73.11.45770 > rhelgw.blade4.53333: Flags [.], ack 2373, win 40, length 0
14:40:31.163639 IP rhelgw.blade4.53333 > 10.133.73.11.45770: Flags [P.], seq 2373:2442, ack 343, win 131, length 69
14:40:31.164210 IP 10.133.73.11.45770 > rhelgw.blade4.53333: Flags [.], ack 2442, win 40, length 0
14:40:31.164669 IP 10.133.73.11.45770 > rhelgw.blade4.53333: Flags [P.], seq 343:684, ack 2442, win 40, length 341
14:40:31.164682 IP rhelgw.blade4.53333 > 10.133.73.11.45770: Flags [.], ack 684, win 140, length 0
14:40:31.165085 IP 10.133.73.11.45770 > rhelgw.blade4.53333: Flags [P.], seq 684:833, ack 2442, win 40, length 149
14:40:31.165097 IP rhelgw.blade4.53333 > 10.133.73.11.45770: Flags [.], ack 833, win 148, length 0
14:40:31.177112 ARP, Request who-has 10.133.39.197 tell 10.133.39.1, length 46
14:40:31.205457 IP rhelgw.blade4.53333 > 10.133.73.11.45770: Flags [P.], seq 2442:2831, ack 833, win 148, length 389
14:40:31.210750 IP 10.133.73.11.45771 > rhelgw.blade4.53333: Flags [S], seq 1060108438, win 14600, options [mss 1460,nop,nop,sackOK,nop,wscale 9], length 0
14:40:31.210795 IP rhelgw.blade4.53333 > 10.133.73.11.45771: Flags [S.], seq 685466798, ack 1060108439, win 14600, options [mss 1460,nop,nop,sackOK,nop,wscale 7], length 0
14:40:31.211152 IP 10.133.73.11.45771 > rhelgw.blade4.53333: Flags [.], ack 1, win 29, length 0
14:40:31.211928 IP 10.133.73.11.45771 > rhelgw.blade4.53333: Flags [P.], seq 1:129, ack 1, win 29, length 128
14:40:31.211945 IP rhelgw.blade4.53333 > 10.133.73.11.45771: Flags [.], ack 129, win 123, length 0
14:40:31.213008 IP rhelgw.blade4.53333 > 10.133.73.11.45771: Flags [.], seq 1:1461, ack 129, win 123, length 1460
14:40:31.213066 IP rhelgw.blade4.53333 > 10.133.73.11.45771: Flags [P.], seq 1461:2367, ack 129, win 123, length 906
14:40:31.213390 IP 10.133.73.11.45771 > rhelgw.blade4.53333: Flags [.], ack 1461, win 35, length 0
14:40:31.214014 IP 10.133.73.11.45771 > rhelgw.blade4.53333: Flags [.], ack 2367, win 40, length 0
14:40:31.214028 IP 10.133.73.11.45771 > rhelgw.blade4.53333: Flags [P.], seq 129:268, ack 2367, win 40, length 139
14:40:31.214099 IP 10.133.73.11.45771 > rhelgw.blade4.53333: Flags [P.], seq 268:274, ack 2367, win 40, length 6
14:40:31.214120 IP rhelgw.blade4.53333 > 10.133.73.11.45771: Flags [.], ack 274, win 131, length 0
14:40:31.214205 IP 10.133.73.11.45771 > rhelgw.blade4.53333: Flags [P.], seq 274:343, ack 2367, win 40, length 69
14:40:31.245572 IP 10.133.73.11.45770 > rhelgw.blade4.53333: Flags [.], ack 2831, win 46, length 0
14:40:31.253312 IP rhelgw.blade4.53333 > 10.133.73.11.45771: Flags [.], ack 343, win 131, length 0
14:40:31.254623 IP rhelgw.blade4.53333 > 10.133.73.11.45771: Flags [P.], seq 2367:2373, ack 343, win 131, length 6
14:40:31.294539 IP rhelgw.blade4.53333 > 10.133.73.11.45771: Flags [P.], seq 2373:2442, ack 343, win 131, length 69
14:40:31.294602 IP 10.133.73.11.45771 > rhelgw.blade4.53333: Flags [.], ack 2373, win 40, length 0
14:40:31.295112 IP 10.133.73.11.45771 > rhelgw.blade4.53333: Flags [.], ack 2442, win 40, length 0
14:40:31.295574 IP 10.133.73.11.45771 > rhelgw.blade4.53333: Flags [P.], seq 343:684, ack 2442, win 40, length 341
14:40:31.295595 IP rhelgw.blade4.53333 > 10.133.73.11.45771: Flags [.], ack 684, win 140, length 0
14:40:31.295934 IP 10.133.73.11.45771 > rhelgw.blade4.53333: Flags [P.], seq 684:833, ack 2442, win 40, length 149
14:40:31.295943 IP rhelgw.blade4.53333 > 10.133.73.11.45771: Flags [.], ack 833, win 148, length 0
14:40:31.300024 IP la120114.apac.avaya.com.51844 > rhelgw.blade4.9016: Flags [.], ack 418, win 255, length 0
14:40:31.336597 IP rhelgw.blade4.53333 > 10.133.73.11.45771: Flags [P.], seq 2442:2655, ack 833, win 148, length 213
14:40:31.337138 ARP, Request who-has 10.133.39.89 tell 10.133.39.1, length 46
14:40:31.341977 IP 10.133.73.11.45772 > rhelgw.blade4.53333: Flags [S], seq 2259272477, win 14600, options [mss 1460,nop,nop,sackOK,nop,wscale 9], length 0
14:40:31.342016 IP rhelgw.blade4.53333 > 10.133.73.11.45772: Flags [S.], seq 2035508094, ack 2259272478, win 14600, options [mss 1460,nop,nop,sackOK,nop,wscale 7], length 0
14:40:31.342428 IP 10.133.73.11.45772 > rhelgw.blade4.53333: Flags [.], ack 1, win 29, length 0
14:40:31.343135 IP 10.133.73.11.45772 > rhelgw.blade4.53333: Flags [P.], seq 1:129, ack 1, win 29, length 128
14:40:31.343153 IP rhelgw.blade4.53333 > 10.133.73.11.45772: Flags [.], ack 129, win 123, length 0
14:40:31.344527 IP rhelgw.blade4.53333 > 10.133.73.11.45772: Flags [.], seq 1:1461, ack 129, win 123, length 1460
14:40:31.344600 IP rhelgw.blade4.53333 > 10.133.73.11.45772: Flags [P.], seq 1461:2367, ack 129, win 123, length 906
14:40:31.344897 IP 10.133.73.11.45772 > rhelgw.blade4.53333: Flags [.], ack 1461, win 35, length 0
14:40:31.345485 IP 10.133.73.11.45772 > rhelgw.blade4.53333: Flags [.], ack 2367, win 40, length 0
14:40:31.345499 IP 10.133.73.11.45772 > rhelgw.blade4.53333: Flags [P.], seq 129:268, ack 2367, win 40, length 139
14:40:31.345636 IP 10.133.73.11.45772 > rhelgw.blade4.53333: Flags [P.], seq 268:274, ack 2367, win 40, length 6
14:40:31.345721 IP rhelgw.blade4.53333 > 10.133.73.11.45772: Flags [.], ack 274, win 131, length 0
14:40:31.345773 IP 10.133.73.11.45772 > rhelgw.blade4.53333: Flags [P.], seq 274:343, ack 2367, win 40, length 69
14:40:31.376537 IP 10.133.73.11.45771 > rhelgw.blade4.53333: Flags [.], ack 2655, win 46, length 0
14:40:31.385274 IP rhelgw.blade4.53333 > 10.133.73.11.45772: Flags [.], ack 343, win 131, length 0
14:40:31.386039 IP rhelgw.blade4.53333 > 10.133.73.11.45772: Flags [P.], seq 2367:2373, ack 343, win 131, length 6
14:40:31.397064 ARP, Request who-has 10.133.39.89 tell 10.133.39.1, length 46
14:40:31.425455 IP rhelgw.blade4.53333 > 10.133.73.11.45772: Flags [P.], seq 2373:2442, ack 343, win 131, length 69
14:40:31.425946 IP 10.133.73.11.45772 > rhelgw.blade4.53333: Flags [.], ack 2442, win 40, length 0
14:40:31.426438 IP 10.133.73.11.45772 > rhelgw.blade4.53333: Flags [P.], seq 343:684, ack 2442, win 40, length 341
14:40:31.426449 IP rhelgw.blade4.53333 > 10.133.73.11.45772: Flags [.], ack 684, win 140, length 0
14:40:31.426820 IP 10.133.73.11.45772 > rhelgw.blade4.53333: Flags [P.], seq 684:849, ack 2442, win 40, length 165
14:40:31.426827 IP rhelgw.blade4.53333 > 10.133.73.11.45772: Flags [.], ack 849, win 148, length 0
14:40:31.467062 IP rhelgw.blade4.53333 > 10.133.73.11.45772: Flags [P.], seq 2442:2655, ack 849, win 148, length 213
14:40:31.472182 IP 10.133.73.11.45773 > rhelgw.blade4.53333: Flags [S], seq 897889541, win 14600, options [mss 1460,nop,nop,sackOK,nop,wscale 9], length 0
14:40:31.472210 IP rhelgw.blade4.53333 > 10.133.73.11.45773: Flags [S.], seq 1110991517, ack 897889542, win 14600, options [mss 1460,nop,nop,sackOK,nop,wscale 7], length 0
14:40:31.472561 IP 10.133.73.11.45773 > rhelgw.blade4.53333: Flags [.], ack 1, win 29, length 0
14:40:31.473274 IP 10.133.73.11.45773 > rhelgw.blade4.53333: Flags [P.], seq 1:129, ack 1, win 29, length 128
14:40:31.473285 IP rhelgw.blade4.53333 > 10.133.73.11.45773: Flags [.], ack 129, win 123, length 0
14:40:31.473871 IP rhelgw.blade4.53333 > 10.133.73.11.45773: Flags [.], seq 1:1461, ack 129, win 123, length 1460
14:40:31.473909 IP rhelgw.blade4.53333 > 10.133.73.11.45773: Flags [P.], seq 1461:2367, ack 129, win 123, length 906
14:40:31.474222 IP 10.133.73.11.45773 > rhelgw.blade4.53333: Flags [.], ack 1461, win 35, length 0
14:40:31.474844 IP 10.133.73.11.45773 > rhelgw.blade4.53333: Flags [.], ack 2367, win 40, length 0
14:40:31.474865 IP 10.133.73.11.45773 > rhelgw.blade4.53333: Flags [P.], seq 129:268, ack 2367, win 40, length 139
14:40:31.475003 IP 10.133.73.11.45773 > rhelgw.blade4.53333: Flags [P.], seq 268:274, ack 2367, win 40, length 6
14:40:31.475030 IP rhelgw.blade4.53333 > 10.133.73.11.45773: Flags [.], ack 274, win 131, length 0
14:40:31.475144 IP 10.133.73.11.45773 > rhelgw.blade4.53333: Flags [P.], seq 274:343, ack 2367, win 40, length 69
14:40:31.494441 IP rhelgw.blade4.teradataordbms > 63vbg32.apac.avaya.com.60687: Flags [P.], seq 864:976, ack 1, win 180, length 112
14:40:31.506961 ARP, Request who-has 10.133.39.89 tell 10.133.39.1, length 46
14:40:31.507471 IP 10.133.73.11.45772 > rhelgw.blade4.53333: Flags [.], ack 2655, win 46, length 0
14:40:31.514275 IP rhelgw.blade4.53333 > 10.133.73.11.45773: Flags [.], ack 343, win 131, length 0
14:40:31.514979 IP rhelgw.blade4.53333 > 10.133.73.11.45773: Flags [P.], seq 2367:2373, ack 343, win 131, length 6
14:40:31.554462 IP rhelgw.blade4.53333 > 10.133.73.11.45773: Flags [P.], seq 2373:2442, ack 343, win 131, length 69
14:40:31.554594 IP 10.133.73.11.45773 > rhelgw.blade4.53333: Flags [.], ack 2373, win 40, length 0
14:40:31.554895 IP 10.133.73.11.45773 > rhelgw.blade4.53333: Flags [.], ack 2442, win 40, length 0
14:40:31.555319 IP 10.133.73.11.45773 > rhelgw.blade4.53333: Flags [P.], seq 343:684, ack 2442, win 40, length 341
14:40:31.555327 IP rhelgw.blade4.53333 > 10.133.73.11.45773: Flags [.], ack 684, win 140, length 0
14:40:31.555384 IP 10.133.73.11.45773 > rhelgw.blade4.53333: Flags [P.], seq 684:849, ack 2442, win 40, length 165
14:40:31.555389 IP rhelgw.blade4.53333 > 10.133.73.11.45773: Flags [.], ack 849, win 148, length 0
14:40:31.596122 IP rhelgw.blade4.53333 > 10.133.73.11.45773: Flags [P.], seq 2442:2831, ack 849, win 148, length 389
14:40:31.601798 IP 10.133.73.11.45774 > rhelgw.blade4.53333: Flags [S], seq 3963598592, win 14600, options [mss 1460,nop,nop,sackOK,nop,wscale 9], length 0
14:40:31.601826 IP rhelgw.blade4.53333 > 10.133.73.11.45774: Flags [S.], seq 4238193694, ack 3963598593, win 14600, options [mss 1460,nop,nop,sackOK,nop,wscale 7], length 0
14:40:31.602240 IP 10.133.73.11.45774 > rhelgw.blade4.53333: Flags [.], ack 1, win 29, length 0
14:40:31.603102 IP 10.133.73.11.45774 > rhelgw.blade4.53333: Flags [P.], seq 1:129, ack 1, win 29, length 128
14:40:31.603111 IP rhelgw.blade4.53333 > 10.133.73.11.45774: Flags [.], ack 129, win 123, length 0
14:40:31.603640 IP rhelgw.blade4.53333 > 10.133.73.11.45774: Flags [.], seq 1:1461, ack 129, win 123, length 1460
14:40:31.603681 IP rhelgw.blade4.53333 > 10.133.73.11.45774: Flags [P.], seq 1461:2367, ack 129, win 123, length 906
14:40:31.603974 IP 10.133.73.11.45774 > rhelgw.blade4.53333: Flags [.], ack 1461, win 35, length 0
14:40:31.604565 IP 10.133.73.11.45774 > rhelgw.blade4.53333: Flags [.], ack 2367, win 40, length 0
14:40:31.604581 IP 10.133.73.11.45774 > rhelgw.blade4.53333: Flags [P.], seq 129:268, ack 2367, win 40, length 139
14:40:31.604729 IP 10.133.73.11.45774 > rhelgw.blade4.53333: Flags [P.], seq 268:274, ack 2367, win 40, length 6
14:40:31.604749 IP rhelgw.blade4.53333 > 10.133.73.11.45774: Flags [.], ack 274, win 131, length 0
14:40:31.604885 IP 10.133.73.11.45774 > rhelgw.blade4.53333: Flags [P.], seq 274:343, ack 2367, win 40, length 69
14:40:31.607780 IP rhelgw.blade4.9017 > la120091.apac.avaya.com.60254: Flags [P.], seq 224:336, ack 1, win 157, length 112
14:40:31.636558 IP 10.133.73.11.45773 > rhelgw.blade4.53333: Flags [.], ack 2831, win 46, length 0
14:40:31.644260 IP rhelgw.blade4.53333 > 10.133.73.11.45774: Flags [.], ack 343, win 131, length 0
14:40:31.644969 IP rhelgw.blade4.53333 > 10.133.73.11.45774: Flags [P.], seq 2367:2373, ack 343, win 131, length 6
14:40:31.646826 ARP, Request who-has 10.133.39.57 tell 10.133.39.1, length 46
14:40:31.657993 IP la120091.apac.avaya.com.60254 > rhelgw.blade4.9017: Flags [.], ack 336, win 251, length 0
14:40:31.667109 ARP, Request who-has 10.133.39.89 tell 10.133.39.1, length 46
14:40:31.684486 IP rhelgw.blade4.53333 > 10.133.73.11.45774: Flags [P.], seq 2373:2442, ack 343, win 131, length 69
14:40:31.685116 IP 10.133.73.11.45774 > rhelgw.blade4.53333: Flags [.], ack 2442, win 40, length 0
14:40:31.685639 IP 10.133.73.11.45774 > rhelgw.blade4.53333: Flags [P.], seq 343:684, ack 2442, win 40, length 341
14:40:31.685646 IP rhelgw.blade4.53333 > 10.133.73.11.45774: Flags [.], ack 684, win 140, length 0
14:40:31.685661 IP 10.133.73.11.45774 > rhelgw.blade4.53333: Flags [P.], seq 684:849, ack 2442, win 40, length 165
14:40:31.685664 IP rhelgw.blade4.53333 > 10.133.73.11.45774: Flags [.], ack 849, win 148, length 0
14:40:31.686489 IP rhelgw.blade4.53333 > 10.133.73.11.45774: Flags [P.], seq 2442:2655, ack 849, win 148, length 213
14:40:31.692263 IP 10.133.73.11.45775 > rhelgw.blade4.53333: Flags [S], seq 335189632, win 14600, options [mss 1460,nop,nop,sackOK,nop,wscale 9], length 0
14:40:31.692316 IP rhelgw.blade4.53333 > 10.133.73.11.45775: Flags [S.], seq 4272180727, ack 335189633, win 14600, options [mss 1460,nop,nop,sackOK,nop,wscale 7], length 0
14:40:31.692624 IP 10.133.73.11.45775 > rhelgw.blade4.53333: Flags [.], ack 1, win 29, length 0
14:40:31.693355 IP 10.133.73.11.45775 > rhelgw.blade4.53333: Flags [P.], seq 1:129, ack 1, win 29, length 128
14:40:31.693364 IP rhelgw.blade4.53333 > 10.133.73.11.45775: Flags [.], ack 129, win 123, length 0
14:40:31.693912 IP rhelgw.blade4.53333 > 10.133.73.11.45775: Flags [.], seq 1:1461, ack 129, win 123, length 1460
14:40:31.693950 IP rhelgw.blade4.53333 > 10.133.73.11.45775: Flags [P.], seq 1461:2367, ack 129, win 123, length 906
14:40:31.694264 IP 10.133.73.11.45775 > rhelgw.blade4.53333: Flags [.], ack 1461, win 35, length 0
14:40:31.694283 IP 10.133.73.11.45775 > rhelgw.blade4.53333: Flags [.], ack 2367, win 40, length 0
14:40:31.694705 IP 63vbg32.apac.avaya.com.60687 > rhelgw.blade4.teradataordbms: Flags [.], ack 976, win 256, length 0
14:40:31.694914 IP 10.133.73.11.45775 > rhelgw.blade4.53333: Flags [P.], seq 129:268, ack 2367, win 40, length 139
14:40:31.695039 IP 10.133.73.11.45775 > rhelgw.blade4.53333: Flags [P.], seq 268:274, ack 2367, win 40, length 6
14:40:31.695056 IP rhelgw.blade4.53333 > 10.133.73.11.45775: Flags [.], ack 274, win 131, length 0
14:40:31.695160 IP 10.133.73.11.45775 > rhelgw.blade4.53333: Flags [P.], seq 274:343, ack 2367, win 40, length 69
14:40:31.726632 IP 10.133.73.11.45774 > rhelgw.blade4.53333: Flags [.], ack 2655, win 46, length 0
14:40:31.734313 IP rhelgw.blade4.53333 > 10.133.73.11.45775: Flags [.], ack 343, win 131, length 0
14:40:31.735274 IP rhelgw.blade4.53333 > 10.133.73.11.45775: Flags [P.], seq 2367:2373, ack 343, win 131, length 6
14:40:31.774612 IP rhelgw.blade4.53333 > 10.133.73.11.45775: Flags [P.], seq 2373:2442, ack 343, win 131, length 69
14:40:31.775348 IP 10.133.73.11.45775 > rhelgw.blade4.53333: Flags [.], ack 2442, win 40, length 0
14:40:31.776007 IP 10.133.73.11.45775 > rhelgw.blade4.53333: Flags [P.], seq 343:684, ack 2442, win 40, length 341
14:40:31.776027 IP rhelgw.blade4.53333 > 10.133.73.11.45775: Flags [.], ack 684, win 140, length 0
14:40:31.776059 IP 10.133.73.11.45775 > rhelgw.blade4.53333: Flags [P.], seq 684:849, ack 2442, win 40, length 165
14:40:31.776065 IP rhelgw.blade4.53333 > 10.133.73.11.45775: Flags [.], ack 849, win 148, length 0
14:40:31.777219 IP rhelgw.blade4.53333 > 10.133.73.11.45775: Flags [P.], seq 2442:2655, ack 849, win 148, length 213
14:40:31.782216 IP 10.133.73.11.45776 > rhelgw.blade4.53333: Flags [S], seq 1079521234, win 14600, options [mss 1460,nop,nop,sackOK,nop,wscale 9], length 0
14:40:31.782256 IP rhelgw.blade4.53333 > 10.133.73.11.45776: Flags [S.], seq 2508096987, ack 1079521235, win 14600, options [mss 1460,nop,nop,sackOK,nop,wscale 7], length 0
14:40:31.782709 IP 10.133.73.11.45776 > rhelgw.blade4.53333: Flags [.], ack 1, win 29, length 0
14:40:31.783278 IP 10.133.73.11.45776 > rhelgw.blade4.53333: Flags [P.], seq 1:129, ack 1, win 29, length 128
14:40:31.783294 IP rhelgw.blade4.53333 > 10.133.73.11.45776: Flags [.], ack 129, win 123, length 0
14:40:31.784743 IP rhelgw.blade4.53333 > 10.133.73.11.45776: Flags [.], seq 1:1461, ack 129, win 123, length 1460
14:40:31.784811 IP rhelgw.blade4.53333 > 10.133.73.11.45776: Flags [P.], seq 1461:2367, ack 129, win 123, length 906
14:40:31.785123 IP 10.133.73.11.45776 > rhelgw.blade4.53333: Flags [.], ack 1461, win 35, length 0
14:40:31.785678 IP 10.133.73.11.45776 > rhelgw.blade4.53333: Flags [.], ack 2367, win 40, length 0
14:40:31.785696 IP 10.133.73.11.45776 > rhelgw.blade4.53333: Flags [P.], seq 129:268, ack 2367, win 40, length 139
14:40:31.785780 IP 10.133.73.11.45776 > rhelgw.blade4.53333: Flags [P.], seq 268:274, ack 2367, win 40, length 6
14:40:31.785844 IP rhelgw.blade4.53333 > 10.133.73.11.45776: Flags [.], ack 274, win 131, length 0
14:40:31.785873 IP 10.133.73.11.45776 > rhelgw.blade4.53333: Flags [P.], seq 274:343, ack 2367, win 40, length 69
14:40:31.817645 IP 10.133.73.11.45775 > rhelgw.blade4.53333: Flags [.], ack 2655, win 46, length 0
14:40:31.825295 IP rhelgw.blade4.53333 > 10.133.73.11.45776: Flags [.], ack 343, win 131, length 0
14:40:31.826649 IP rhelgw.blade4.53333 > 10.133.73.11.45776: Flags [P.], seq 2367:2373, ack 343, win 131, length 6
14:40:31.866473 IP rhelgw.blade4.53333 > 10.133.73.11.45776: Flags [P.], seq 2373:2442, ack 343, win 131, length 69
14:40:31.866529 IP 10.133.73.11.45776 > rhelgw.blade4.53333: Flags [.], ack 2373, win 40, length 0
14:40:31.866977 IP 10.133.73.11.45776 > rhelgw.blade4.53333: Flags [.], ack 2442, win 40, length 0
14:40:31.867927 IP 10.133.73.11.45776 > rhelgw.blade4.53333: Flags [P.], seq 343:684, ack 2442, win 40, length 341
14:40:31.867940 IP rhelgw.blade4.53333 > 10.133.73.11.45776: Flags [.], ack 684, win 140, length 0
14:40:31.867961 IP 10.133.73.11.45776 > rhelgw.blade4.53333: Flags [P.], seq 684:833, ack 2442, win 40, length 149
14:40:31.867965 IP rhelgw.blade4.53333 > 10.133.73.11.45776: Flags [.], ack 833, win 148, length 0
14:40:31.869028 IP rhelgw.blade4.53333 > 10.133.73.11.45776: Flags [P.], seq 2442:2783, ack 833, win 148, length 341
14:40:31.873952 IP 10.133.73.11.45777 > rhelgw.blade4.53333: Flags [S], seq 3664137918, win 14600, options [mss 1460,nop,nop,sackOK,nop,wscale 9], length 0
14:40:31.873987 IP rhelgw.blade4.53333 > 10.133.73.11.45777: Flags [S.], seq 3003840918, ack 3664137919, win 14600, options [mss 1460,nop,nop,sackOK,nop,wscale 7], length 0
14:40:31.874464 IP 10.133.73.11.45777 > rhelgw.blade4.53333: Flags [.], ack 1, win 29, length 0
14:40:31.875193 IP 10.133.73.11.45777 > rhelgw.blade4.53333: Flags [P.], seq 1:129, ack 1, win 29, length 128
14:40:31.875203 IP rhelgw.blade4.53333 > 10.133.73.11.45777: Flags [.], ack 129, win 123, length 0
14:40:31.876049 IP rhelgw.blade4.53333 > 10.133.73.11.45777: Flags [.], seq 1:1461, ack 129, win 123, length 1460
14:40:31.876094 IP rhelgw.blade4.53333 > 10.133.73.11.45777: Flags [P.], seq 1461:2367, ack 129, win 123, length 906
14:40:31.876444 IP 10.133.73.11.45777 > rhelgw.blade4.53333: Flags [.], ack 1461, win 35, length 0
14:40:31.876456 IP 10.133.73.11.45777 > rhelgw.blade4.53333: Flags [.], ack 2367, win 40, length 0
14:40:31.876993 IP 10.133.73.11.45777 > rhelgw.blade4.53333: Flags [P.], seq 129:268, ack 2367, win 40, length 139
14:40:31.877142 IP 10.133.73.11.45777 > rhelgw.blade4.53333: Flags [P.], seq 268:274, ack 2367, win 40, length 6
14:40:31.877164 IP rhelgw.blade4.53333 > 10.133.73.11.45777: Flags [.], ack 274, win 131, length 0
14:40:31.877271 IP 10.133.73.11.45777 > rhelgw.blade4.53333: Flags [P.], seq 274:343, ack 2367, win 40, length 69
14:40:31.908567 IP 10.133.73.11.45776 > rhelgw.blade4.53333: Flags [.], ack 2783, win 46, length 0
14:40:31.917198 IP rhelgw.blade4.53333 > 10.133.73.11.45777: Flags [P.], seq 2367:2373, ack 343, win 131, length 6
14:40:31.918776 IP drlablic2.dr.avaya.com.52233 > rhelgw.blade4.51284: Flags [.], seq 1042991276:1042991277, ack 2824561624, win 5416, length 1
14:40:31.918789 IP rhelgw.blade4.51284 > drlablic2.dr.avaya.com.52233: Flags [.], ack 1, win 263, options [nop,nop,sack 1 {0:1}], length 0
14:40:31.918987 IP rhelgw.blade4.36816 > in307437-pune-dns-ns1.apac.avaya.com.domain: 54339+ PTR? 64.181.9.135.in-addr.arpa. (43)
14:40:31.919573 IP in307437-pune-dns-ns1.apac.avaya.com.domain > rhelgw.blade4.36816: 54339* 1/0/0 PTR drlablic2.dr.avaya.com. (79)
14:40:31.956544 IP rhelgw.blade4.53333 > 10.133.73.11.45777: Flags [P.], seq 2373:2442, ack 343, win 131, length 69
14:40:31.957095 IP 10.133.73.11.45777 > rhelgw.blade4.53333: Flags [.], ack 2442, win 40, length 0
14:40:31.957638 IP 10.133.73.11.45777 > rhelgw.blade4.53333: Flags [P.], seq 343:684, ack 2442, win 40, length 341
14:40:31.957651 IP 10.133.73.11.45777 > rhelgw.blade4.53333: Flags [P.], seq 684:833, ack 2442, win 40, length 149
14:40:31.957685 IP rhelgw.blade4.53333 > 10.133.73.11.45777: Flags [.], ack 833, win 148, length 0
14:40:31.958680 IP rhelgw.blade4.53333 > 10.133.73.11.45777: Flags [P.], seq 2442:2655, ack 833, win 148, length 213
14:40:31.964185 IP 10.133.73.11.45778 > rhelgw.blade4.53333: Flags [S], seq 3562884425, win 14600, options [mss 1460,nop,nop,sackOK,nop,wscale 9], length 0
14:40:31.964214 IP rhelgw.blade4.53333 > 10.133.73.11.45778: Flags [S.], seq 519267715, ack 3562884426, win 14600, options [mss 1460,nop,nop,sackOK,nop,wscale 7], length 0
14:40:31.964507 IP 10.133.73.11.45778 > rhelgw.blade4.53333: Flags [.], ack 1, win 29, length 0
14:40:31.965254 IP 10.133.73.11.45778 > rhelgw.blade4.53333: Flags [P.], seq 1:129, ack 1, win 29, length 128
14:40:31.965265 IP rhelgw.blade4.53333 > 10.133.73.11.45778: Flags [.], ack 129, win 123, length 0
14:40:31.965944 IP rhelgw.blade4.53333 > 10.133.73.11.45778: Flags [.], seq 1:1461, ack 129, win 123, length 1460
14:40:31.965990 IP rhelgw.blade4.53333 > 10.133.73.11.45778: Flags [P.], seq 1461:2367, ack 129, win 123, length 906
14:40:31.966300 IP 10.133.73.11.45778 > rhelgw.blade4.53333: Flags [.], ack 1461, win 35, length 0
14:40:31.966886 IP 10.133.73.11.45778 > rhelgw.blade4.53333: Flags [.], ack 2367, win 40, length 0
14:40:31.966898 IP 10.133.73.11.45778 > rhelgw.blade4.53333: Flags [P.], seq 129:268, ack 2367, win 40, length 139
14:40:31.967010 IP 10.133.73.11.45778 > rhelgw.blade4.53333: Flags [P.], seq 268:274, ack 2367, win 40, length 6
14:40:31.967080 IP rhelgw.blade4.53333 > 10.133.73.11.45778: Flags [.], ack 274, win 131, length 0
14:40:31.967124 IP 10.133.73.11.45778 > rhelgw.blade4.53333: Flags [P.], seq 274:343, ack 2367, win 40, length 69
14:40:31.998530 IP 10.133.73.11.45777 > rhelgw.blade4.53333: Flags [.], ack 2655, win 46, length 0
14:40:32.006276 IP rhelgw.blade4.53333 > 10.133.73.11.45778: Flags [.], ack 343, win 131, length 0
14:40:32.007143 IP rhelgw.blade4.53333 > 10.133.73.11.45778: Flags [P.], seq 2367:2373, ack 343, win 131, length 6
14:40:32.046438 IP rhelgw.blade4.53333 > 10.133.73.11.45778: Flags [P.], seq 2373:2442, ack 343, win 131, length 69
14:40:32.047003 IP 10.133.73.11.45778 > rhelgw.blade4.53333: Flags [.], ack 2442, win 40, length 0
14:40:32.047518 IP 10.133.73.11.45778 > rhelgw.blade4.53333: Flags [P.], seq 343:684, ack 2442, win 40, length 341
14:40:32.047528 IP rhelgw.blade4.53333 > 10.133.73.11.45778: Flags [.], ack 684, win 140, length 0
14:40:32.047545 IP 10.133.73.11.45778 > rhelgw.blade4.53333: Flags [P.], seq 684:849, ack 2442, win 40, length 165
14:40:32.047550 IP rhelgw.blade4.53333 > 10.133.73.11.45778: Flags [.], ack 849, win 148, length 0
14:40:32.048556 IP rhelgw.blade4.53333 > 10.133.73.11.45778: Flags [P.], seq 2442:2831, ack 849, win 148, length 389
14:40:32.053332 IP 10.133.73.11.45779 > rhelgw.blade4.53333: Flags [S], seq 1734027096, win 14600, options [mss 1460,nop,nop,sackOK,nop,wscale 9], length 0
14:40:32.053359 IP rhelgw.blade4.53333 > 10.133.73.11.45779: Flags [S.], seq 647319744, ack 1734027097, win 14600, options [mss 1460,nop,nop,sackOK,nop,wscale 7], length 0
14:40:32.053632 IP 10.133.73.11.45779 > rhelgw.blade4.53333: Flags [.], ack 1, win 29, length 0
14:40:32.054314 IP 10.133.73.11.45779 > rhelgw.blade4.53333: Flags [P.], seq 1:129, ack 1, win 29, length 128
14:40:32.054323 IP rhelgw.blade4.53333 > 10.133.73.11.45779: Flags [.], ack 129, win 123, length 0
14:40:32.054868 IP rhelgw.blade4.53333 > 10.133.73.11.45779: Flags [.], seq 1:1461, ack 129, win 123, length 1460
14:40:32.054912 IP rhelgw.blade4.53333 > 10.133.73.11.45779: Flags [P.], seq 1461:2367, ack 129, win 123, length 906
14:40:32.055188 IP 10.133.73.11.45779 > rhelgw.blade4.53333: Flags [.], ack 1461, win 35, length 0
14:40:32.055758 IP 10.133.73.11.45779 > rhelgw.blade4.53333: Flags [.], ack 2367, win 40, length 0
14:40:32.055777 IP 10.133.73.11.45779 > rhelgw.blade4.53333: Flags [P.], seq 129:268, ack 2367, win 40, length 139
14:40:32.055896 IP 10.133.73.11.45779 > rhelgw.blade4.53333: Flags [P.], seq 268:274, ack 2367, win 40, length 6
14:40:32.055929 IP rhelgw.blade4.53333 > 10.133.73.11.45779: Flags [.], ack 274, win 131, length 0
14:40:32.056011 IP 10.133.73.11.45779 > rhelgw.blade4.53333: Flags [P.], seq 274:343, ack 2367, win 40, length 69
14:40:32.088563 IP 10.133.73.11.45778 > rhelgw.blade4.53333: Flags [.], ack 2831, win 46, length 0
14:40:32.095267 IP rhelgw.blade4.53333 > 10.133.73.11.45779: Flags [.], ack 343, win 131, length 0
14:40:32.096095 IP rhelgw.blade4.53333 > 10.133.73.11.45779: Flags [P.], seq 2367:2373, ack 343, win 131, length 6
14:40:32.135498 IP rhelgw.blade4.53333 > 10.133.73.11.45779: Flags [P.], seq 2373:2442, ack 343, win 131, length 69
14:40:32.136081 IP 10.133.73.11.45779 > rhelgw.blade4.53333: Flags [.], ack 2442, win 40, length 0
14:40:32.136618 IP 10.133.73.11.45779 > rhelgw.blade4.53333: Flags [P.], seq 343:684, ack 2442, win 40, length 341
14:40:32.136628 IP rhelgw.blade4.53333 > 10.133.73.11.45779: Flags [.], ack 684, win 140, length 0
14:40:32.136996 IP 10.133.73.11.45779 > rhelgw.blade4.53333: Flags [P.], seq 684:849, ack 2442, win 40, length 165
14:40:32.137002 IP rhelgw.blade4.53333 > 10.133.73.11.45779: Flags [.], ack 849, win 148, length 0
